{
  "schema_version": "1.0.0",
  "run_id": "10fab674-a4ea-47d7-90fc-2a34f9891845",
  "event_id": "b6601c2d-24d5-48f6-8e46-b6310d7e59f0",
  "timestamp_utc": "2026-09-17T09:00:00Z",
  "event_type": "run_summary",
  "project": "example-project",
  "agent_client": "benchmark-model",
  "model": "qwen3.6:27b-coding",
  "model_digest": null,
  "profile": "coding-large",
  "operation_tool": "ollama.generate",
  "task_type": "direct-benchmark",
  "duration_ms": 63000,
  "input_tokens": null,
  "output_tokens": 773,
  "context_configured": 49152,
  "context_used": null,
  "prompt_tokens_per_second": 103.66,
  "generation_tokens_per_second": 12.34,
  "tool_call_count": 0,
  "status": "succeeded",
  "error_category": null,
  "error_code": null,
  "error_fingerprint": null,
  "retry_count": 0,
  "eval_suite": null,
  "eval_version": null,
  "eval_score": null,
  "structured_output_compliant": null,
  "test_status": null,
  "review_status": "unreviewed",
  "profile_version": "0.1.0",
  "ollama_version": "0.34.1",
  "client_version": "0.1.0",
  "hardware_profile": "current-machine-v1",
  "config_version": "v0.1"
}
